{
  "$schema": "http://json-schema.org/draft-07/schema#",
  "title": "rharness venue.json",
  "type": "object",
  "required": ["venue", "cycle", "name", "revision", "deadlines", "primary", "anonymous"],
  "properties": {
    "venue": {"type": "string"},
    "cycle": {"type": "string", "pattern": "^\\d{4}$"},
    "name": {"type": "string", "pattern": "^[a-z][a-z0-9-]*\\d{4}$", "description": "venue + cycle"},
    "revision": {"type": "string", "pattern": "^\\d{4}-\\d{2}-\\d{2}$", "description": "date the metadata was last checked against sources"},
    "deadlines": {"type": "object", "minProperties": 1,
                  "additionalProperties": {"type": "string", "pattern": "^\\d{4}-\\d{2}-\\d{2}T\\d{2}:\\d{2}:\\d{2}(Z|[+-]\\d{2}:\\d{2})$"}},
    "primary": {"type": "string", "description": "one key of deadlines"},
    "page_limit": {"type": "object", "required": ["main"],
                   "properties": {"main": {"type": "integer", "minimum": 1},
                                  "excludes": {"type": "array", "items": {"type": "string"}}}},
    "anonymous": {"type": "boolean"},
    "author_block": {"type": "object", "description": "when the style hides \\author and \\thanks: a regex over the comment-stripped tex",
                     "oneOf": [{"required": ["hidden_if"]}, {"required": ["hidden_unless"]}],
                     "properties": {"hidden_if": {"type": "string"}, "hidden_unless": {"type": "string"}},
                     "additionalProperties": false},
    "template": {"oneOf": [
      {"type": "object", "required": ["repo", "ref", "files"],
       "properties": {"repo": {"type": "string"}, "ref": {"type": "string"}, "files": {"type": "array", "minItems": 1, "items": {"type": "string"}}}},
      {"type": "object", "required": ["url", "sha256", "extract"],
       "properties": {"url": {"type": "string"}, "sha256": {"type": "string", "pattern": "^[0-9a-f]{64}$"}, "extract": {"type": "array", "minItems": 1, "items": {"type": "string"}}}}
    ]},
    "required_sections": {"type": "array", "items": {"type": "string"}},
    "sources": {"type": "array", "items": {"type": "object", "required": ["kind", "url", "retrieved"],
                "properties": {"kind": {"type": "string"}, "url": {"type": "string"}, "retrieved": {"type": "string", "pattern": "^\\d{4}-\\d{2}-\\d{2}$"}}}}
  }
}
